35989327;01.07.1999;31.12.2500;;165182;90010;;331;4;24;610;23;10;SK032;SK0321;SK0321508438;1110;13110;Štátna opera;Štátna opera;Hromada;Rudolf;;;Národná;;11;97473;Banská Bystrica 1
31299512;01.07.1999;31.12.2500;35515554;165182;90040;;331;4;24;610;24;10;SK042;SK0422;SK0422598186;1110;13110;Štátne divadlo Košice;Štátne divadlo Košice;Himič;Peter;16;;Hlavná;;58;04001;Košice 1
36192040;19.11.1991;22.08.1999;;;;;501;4;27;101;0;999;SK042;SK0426;SK0426521698;9100;;AGROKOV, š.p. Nitra, odštepný závod Moldava nad Bodvou;AGROKOV, š.p. Nitra, odštepný závod Moldava;Tóth;Ladislav;;;Moldava nad Bodvou;;;04501;Moldava nad Bodvou
36148563;01.09.1999;31.12.2500;;;85310;;321;4;20;610;11;999;SK031;SK031B;SK031B517402;1110;13110;Gymnázium bilingválne;Gymnázium bilingválne;Vanková;Gabriela;16;;Ul. T. Ružičku;;3;01001;Žilina 1
35989858;01.09.1999;31.08.2013;;;85200;;321;4;20;610;0;999;SK032;SK0325;SK0325518409;1110;;Špeciálna základná škola;Špeciálna základná škola;Chrienová;Silvia;16;;Kostolná;;1;96270;Hontianske Moravce
35989882;01.09.1999;31.12.2500;;;49390;45200;501;4;29;101;0;999;SK032;SK032D;SK032D599328;9100;11001;Slovenská autobusová doprava, Zvolen š.p.,  Odštepný závod 01;SAD Zvolen š.p., OZ 01;Truben;Ján;1;;Priemyselná;;257;96513;Žiar nad Hronom 1
35989891;01.09.1999;31.12.2500;;;49390;45200;501;4;29;101;0;999;SK032;SK032A;SK032A516210;9100;11001;Slovenská autobusová doprava Zvolen, š.p., Odštepný závod 02;SAD Zvolen, š.p. OZ 02 Modrý Kameň;Gabúľ;Vladimír;1;;Jarmočná;332;29;99280;Modrý Kameň
17056381;01.01.1993;05.06.2003;;;;;501;4;29;101;0;999;SK010;SK0101;SK0101528595;9100;;Slovenská pošta, š.p., Západoslovenské riaditeľstvo pôšt, Bratislava;Slov.pošta, š.p., Zsl. riaditeľstvo pôšt;Obický;Vladimír;1;;Nám. Slobody;;27;81005;Bratislava 15
36104922;01.09.1999;31.12.2005;;;;;321;4;20;610;0;999;SK023;SK0234;SK0234503011;1110;;Pedagogicko-psychologická poradňa;Pedagogicko-psychologická poradňa;Kisely;Juraj;8;51;Turecká;;35;94001;Nové Zámky 1
35990333;01.09.1999;31.12.2500;;;49390;"45200; 77350";501;4;29;101;0;999;SK032;SK0323;SK0323508497;9100;11001;Slovenská autobusová doprava Banskobystrická dopravná spoločnosť, štátny podnik Odštepný závod, Brezno;Slovenská autobusová doprava Banskobystrická;Kupčok;Slavomír;1;;Osloboditeľov;;31;97701;Brezno
31797512;01.10.1999;30.09.2004;;;;;501;4;29;101;0;999;SK010;SK0103;SK0103529346;9100;;Slovenská pošta, š.p., Technická ústredňa pôšt, Bratislava;Slovenská pošta, š.p., TÚP, Bratislava;Láni;Miroslav;1;;Kukučínova;;52;83103;Bratislava 3
36038351;29.10.1999;31.12.2500;"00694762; 35730323; 00694789; 00605301; 00694771; 36448559; 00694720; 00694690; 00156663; 00156655; 00694711; 00694738";156621;2100;"71121; 49410; 46730; 63110; 25620; 33120; 10130";301;4;27;101;33;120;SK032;SK0321;SK0321508438;1100;11001;LESY Slovenskej republiky, štátny podnik;LESY Slovenskej republiky, štátny podnik;Staník;Marian;1;;Námestie SNP;;8;97566;Banská Bystrica 1
36308609;21.02.1995;07.08.2002;;;64190;;121;4;57;421;0;999;SK022;SK0227;SK0227513881;1100;;Slovenská sporiteľňa, a. s. Prievidza;Slovenská sporiteľňa, a. s. Prievidza;Horváthová;Elena;1;;nám. Slobody;;8;97101;Prievidza 1
36308617;21.02.1995;09.04.2001;;;64190;;121;4;57;421;0;999;SK022;SK0226;SK0226512842;1100;;Slovenská sporiteľňa, a. s. Považská Bystrica;Slovenská sporiteľňa, a.s. Považská Bystrica;Stráňovská;Oľga;1;;nám. Andreja Hlinku;;26;01701;Považská Bystrica 1
31797873;01.12.1999;31.12.2003;;;;;321;4;27;610;0;999;SK010;SK0101;SK0101528595;1110;;Agentúra SAPARD;Agentúra SAPARD;;;;;Dobrovičova;;12;81266;Bratislava 1
35776005;10.11.1999;31.12.2500;31338909;;81100;"69200; 46190; 68310";121;4;15;610;21;80;SK010;SK0101;SK0101528595;1110;13110;Slovenská konsolidačná, a.s.;Slovenská konsolidačná, a.s.;Pôbiš, MBA;Michal;1;;Cintorínska;;21;81499;Bratislava 1
31797903;01.01.2000;31.12.2500;;;84110;;321;4;33;610;22;999;SK010;SK0102;SK0102529320;1110;13110;Úrad pre verejné obstarávanie;Úrad pre verejné obstarávanie;Hlivák, LLM;Miroslav;3;53;Ružová dolina;606;10;82109;Bratislava 3
31797857;01.01.2000;31.12.2500;;164381;84120;;321;4;20;610;23;999;SK010;SK0104;SK0104529397;1110;13110;Štátna školská inšpekcia;Štátna školská inšpekcia;Kalmárová;Viera;17;;Staré grunty;;52;84104;Bratislava 4
31309691;01.01.2000;31.12.2500;;;85100;;321;4;20;610;6;999;SK042;SK0423;SK0423598224;1110;13110;Špeciálna materská škola;Špeciálna materská škola;Rostecká;Viera;;;Ľudová;;15;04011;Košice 11
31309577;01.01.2000;31.12.2500;;;85200;;321;4;20;610;6;999;SK042;SK0427;SK0427523186;1110;13110;Špeciálna základná škola Trhovište;Špeciálna základná škola Trhovište;Smaržík;Radoslav;1;;Tichá;;50;07204;Trhovište
31309623;01.01.2000;31.12.2003;;;;;321;4;68;610;0;999;SK042;SK0423;SK0423598224;1110;;Špeciálna materská a základná škola pri zdravotníckom zariadení;Špeciálna mat. škola a zákl. škola pri zdr.z;Hvozdíková;Beáta;16;;Trieda SNP;;1;04011;Košice 11
31309674;01.01.2000;31.12.2500;;;85200;;321;4;20;610;11;999;SK042;SK042A;SK042A543284;1110;13110;Špeciálna základná škola;Špeciálna základná škola;Chroustová;Monika;17;;Slovenského raja;;16;05313;Letanovce
31309666;01.01.2000;31.12.2500;;;85200;;321;4;20;610;11;999;SK042;SK042A;SK042A543268;1110;13110;Špeciálna základná škola, Ul. SNP 49, Krompachy;Špeciálna základná škola, Ul.SNP49,Krompachy;Valek;Jozef;16;;Ul. SNP;;49;05342;Krompachy
31309658;01.01.2000;31.12.2500;;;85200;"56102; 85590";321;4;20;610;12;999;SK042;SK042A;SK042A526355;1110;13110;Spojená škola,J.Fabiniho 3,Spišská N.Ves s OZ: Špeciálna ZŠ,J.Fabiniho 3,SNV,ZŠ pri zdrav.zariadení,J.Jánskeho 1,SNV a PŠ,Hviezdoslavova 25, SNV;Spojená škola,J. Fabiniho 3,Spišská Nová Ves;Bazár;Ľuboš;17;;J. Fabiniho;;3;05201;Spišská Nová Ves 1
31309631;01.01.2000;31.12.2500;;;85200;85322;321;4;20;610;11;999;SK042;SK042A;SK042A543519;1110;13110;Spojená škola, Zimné 465, Rudňany;Spojená škola, Zimné 465, Rudňany;Zacharová;Jana;16;;Zimné;465;;05323;Rudňany
31309640;01.01.2000;31.12.2500;;;85200;;321;4;20;610;6;999;SK042;SK042A;SK042A543331;1110;13110;Špeciálna základná škola, Michalská 55/77, Markušovce;Špeciálna základná škola;Tökölyová;Ľubica;16;;Michalská;55;77;05321;Markušovce
31309712;01.01.2000;31.12.2500;;;85200;;321;4;20;610;11;999;SK042;SK042B;SK042B528099;1110;13110;Špeciálna základná škola;Špeciálna základná škola;Magurová;Alena;6;;M. R. Štefánika;871;83;07501;Trebišov 1
31309704;01.01.2000;31.12.2500;;;85200;"85322; 85590; 56102";321;4;20;610;11;999;SK042;SK0428;SK0428525634;1110;13110;Spojená škola, Nová 803, Dobšiná s organizačnými zložkami: Špeciálna základná škola, Nová 803, Dobšiná a Odborné učilište, Nová 803, Dobšiná;Spojená škola, Nová 803, Dobšiná;Sentpéteryová;Božena;16;;Nová;;803;04925;Dobšiná
31309828;01.01.2000;31.12.2500;;;85200;;321;4;20;610;11;999;SK042;SK042B;SK042B528722;1110;13110;Špeciálna základná škola;Špeciálna základná škola;Koncový;Rudolf;17;;SNP;827;53;07801;Sečovce
31309780;01.01.2000;31.12.2500;;;85200;;321;4;20;610;11;999;SK042;SK0429;SK0429523089;1110;13110;Špeciálna základná škola;Špeciálna základná škola;Soročinová;Valéria;16;;Tyršova;;1;07301;Sobrance
31309771;01.01.2000;31.12.2500;;;85200;"85590; 56102";321;4;20;610;11;999;SK042;SK0427;SK0427522872;1110;13110;Spojená škola, Kapušianska 2, Pavlovce nad Uhom s org.zl.: Špeciálna ZŠ, Kapušianska 2, Pavl.nad Uh.a Praktická škola,Kapušianska 2,Pavl.nad Uh.;Spojená škola, Kapušianska 2, Pavlovce n/Uh.;Tirčová;Viola;16;;Kapušianska;;2;07214;Pavlovce nad Uhom
31309585;01.01.2000;31.12.2500;;;85200;;321;4;20;610;6;999;SK042;SK0426;SK0426522163;1110;13110;Špeciálna základná škola Vtáčkovce;Špeciálna základná škola Vtáčkovce;Breichová;Alica;16;;Vtáčkovce;;2;04447;Kecerovce
35778458;01.01.2000;31.12.2500;30810761;30416094;52230;"46900; 58190";301;4;29;101;24;110;SK010;SK0102;SK0102529320;1100;11001;"Letové prevádzkové služby Slovenskej republiky, štátny podnik, (v skratke „LPS SR, š. p."")|Letové prevádzkové služby SR, št.podnik|Zaujec|Blažej|01||Ivanská cesta||93|82307|Bratislava 21";;;;;;;;;;
35991241;01.01.2000;31.12.2500;;30232295;91010;;321;4;20;610;0;999;SK032;SK0321;SK0321508438;1110;13110;Univerzitná knižnica Univerzity Mateja Bela v Banskej Bystrici;Univerzitná knižnica UMB v B.Bystrici;Pažúrová;Helena;8;;Tajovského;;40;97401;Banská Bystrica 1
36106097;01.01.2000;01.01.2002;34005617;;49390;45200;501;4;29;101;0;999;SK023;SK0233;SK0233500933;9100;;Slovenská autobusová doprava Nitra, štátny podnik, odštepný závod Vráble;SAD Nitra, OZ Vráble;Korenči;Milan;1;;Štúrova;1046;97;95201;Vráble
36106101;01.01.2000;01.01.2002;34005501;;49390;;501;4;29;101;0;999;SK023;SK0236;SK0236504998;9100;;Slovenská autobusová doprava Nitra, š.p., odštepný závod Topoľčany;SAD Nitra, OZ Topoľčany;Lanc;Dezider;1;;Dopravná;1364;11;95501;Topoľčany 1
36106119;01.01.2000;01.01.2002;34005609;;49390;;501;4;29;101;0;999;SK023;SK0237;SK0237500968;9100;;Slovenská autobusová doprava Nitra, štátny podnik, odštepný závod Zlaté Moravce;SAD Nitra, š.p., OZ Zlaté Moravce;Farkaš;Ladislav;1;;Staničná;;27;95339;Zlaté Moravce 1
35998652;01.01.1999;31.12.2500;;42181810;91020;;331;4;18;610;12;10;SK032;SK0322;SK0322516643;1110;13110;Slovenské banské múzeum;Slovenské banské múzeum;Labuda;Jozef;8;51;Kammerhofská;;2;96901;Banská Štiavnica 1
37783025;01.07.1999;31.12.2009;;;85200;;321;4;20;610;0;999;SK041;SK0418;SK0418524778;1110;;Špeciálna základná škola;Špeciálna základná škola;;;;;Tehelná;;3;08271;Lipany nad Torysou
36234893;09.12.1999;31.12.2500;00213756;;25610;"47190; 46900; 45200; 46150";301;4;27;101;0;999;SK021;SK0212;SK0212503665;1110;13110;AGROKOV STS, štátny podnik, v likvidácii;AGROKOV STS, štátny podnik, v likvidácii;Ivančík;Daniel;1;;Matúškovská cesta;;874;92401;Galanta 1
31803008;22.05.1998;06.02.2003;;;;;321;4;20;610;0;999;SK010;SK0101;SK0101528595;1110;;Študentský domov a jedáleň Horský park;Študentský domov a jedáleň Horský park;;;;;Prokopa Veľkého;;41;81707;Bratislava 11
36060160;03.03.2000;31.12.2500;"31790917; 31794823; 31794777; 31790925";;84130;;321;4;27;610;11;999;SK010;SK0104;SK0104529389;1110;13110;Regionálna veterinárna a potravinová správa Bratislava - mesto;Reg. veterinárna a potr. správa Bratislava;;;;;Polianky;;8;84101;Bratislava 4
17147867;01.09.1991;06.02.2003;;;;56290;321;4;20;610;0;999;SK042;SK0422;SK0422598151;1110;;Riaditeľstvo študentských domovov a jedální Technickej univerzity v Košiciach;Riaditeľstvo študentských domovov a jedální;Porubänová;Viera;8;;B.Němcovej;;1;04001;Košice 1
36060178;01.01.2000;30.04.2004;;;;;321;4;15;610;0;999;SK010;SK0101;SK0101528595;1110;;Úrad pre štátnu pomoc;Úrad pre štátnu pomoc;;;;;Radlinského;;37;81107;Bratislava 1
35999764;07.10.1998;14.06.2000;;;;;321;4;20;610;0;999;SK032;SK0321;SK0321508438;1110;;Fakulta dramatických umení Akadémie umení v Banskej Bystrici;Fakulta dramtických umení AU B.Bystrica;Turzonovová;Božidara;8;;J.Kollára;;22;97401;Banská Bystrica 1
618985;11.11.1991;27.03.2002;;;;;321;4;20;610;0;999;SK041;SK0414;SK0414543578;1110;;Kňazský seminár biskupa Jána Vojtaššáka v Spišskej Kapitule;Kňazský seminár biskupa Jána Vojtaššáka;;;;;Spišské Podhradie;;;05304;Spišské Podhradie
37816314;01.07.1996;31.12.2500;;;85200;;321;4;20;610;0;999;SK032;SK032C;SK032C517097;1110;13110;Špeciálna základná škola;Špeciálna základná škola;Vozárová;Anna;17;;Rekreačná;;393;96801;Nová Baňa
36060313;17.01.2000;20.03.2002;;;;;321;4;20;610;0;999;SK010;SK0105;SK0105529460;1110;;Fakulta medzinárodných vzťahov Ekonomickej univerzity v Bratislave;Fakulta medzinárodných vzťahov EU;;;;;Dolnozemská cesta;;1;85235;Bratislava 55
584932;01.07.1990;13.06.2000;;;;;501;4;26;101;0;999;SK010;SK0102;SK0102529320;9100;;Slovenský plynárenský priemysel, š.p.  Bratislava, odštepný závod Bratislava;SPP š.p. Bratislava,odštep.závod;Lapuník;Miroslav;1;;Votrubova;;1;82517;Bratislava
37801279;01.07.2000;31.12.2500;;684325;85420;;382;4;20;610;25;10;SK031;SK0318;SK0318510998;1110;13110;Katolícka univerzita v Ružomberku;Katolícka univerzita v Ružomberku;Jarab;ThDr. Jozef;72;53;Hrabovská cesta;5512;1A;03401;Ružomberok 1
36534587;09.12.1999;31.12.2004;;;68200;;301;4;26;101;0;999;SK023;SK0233;SK0233500011;1100;;AGROKOV Nitra, štátny podnik;AGROKOV Nitra, štátny podnik;Mládek;Jozef;1;;Rastislavova;;2;94901;Nitra 1
17056420;01.01.1992;07.02.2008;;;53100;;501;4;29;101;0;999;SK042;SK0422;SK0422598186;9100;;Slovenská pošta, štátny podnik, Východoslovenské riaditeľstvo pôšt Košice;Slov.pošta, š.p., Východosl.riad.pôšt Košice;Relovský;Milan;1;;Thurzova;;1;04221;Košice 1
37819003;01.09.1998;31.12.2500;;;85322;;321;4;20;610;11;999;SK032;SK032A;SK032A516571;1110;13110;Odborné učilište internátne;Odborné učilište internátne;Pástor;Pavel;1;;Gottwaldova;70;43;99106;Želovce
36066869;01.11.2000;01.01.2006;;;66110;84110;382;4;35;441;0;999;SK010;SK0101;SK0101528595;1100;;Úrad pre finančný trh;Úrad pre finančný trh;;;;;Vazovova;;2;81318;Bratislava 1
31965458;01.01.2001;31.12.2500;;;85200;;321;4;20;610;6;999;SK042;SK042B;SK042B528366;1110;13110;Základná škola pri zdravotníckom zariadení Hraň 447;ZŠ pri zdravotníckom zariadení Hraň 447;Fedorová;Dana;1;;Hraň;;447;07603;Hraň
35804670;29.01.2001;20.01.2011;;;47610;53200;121;4;29;101;0;999;SK010;SK0101;SK0101528595;1100;;RAVS, a.s. v likvidácii;RAVS, a.s. v likvidácii;Galamboš;Miroslav;1;;Nám. Slobody;;27;81105;Bratislava 1
35505567;01.02.2001;22.03.2001;;;;;331;4;68;610;0;999;SK042;SK0427;SK0427522589;1110;;Škola v prírode Šírava;Škola v prírode Šírava;Hniďák;Alexander;1;;Zemplínska šírava-Kamenec;;;07236;Kaluža
36204447;12.02.2001;31.12.2500;;;1110;"46230; 46210; 46190; 10910; 01620; 02409";112;4;99;101;12;60;SK042;SK042B;SK042B544019;1100;11001;AGROPODNIK SLAMOZ spol. s r.o.;AGROPODNIK SLAMOZ spol. s r.o.;Spišák;Jaroslav;1;;Hlavná;;480;07664;Zemplínska Teplica
36061611;01.06.2001;31.12.2013;;;84130;;321;4;26;610;0;999;SK010;SK0102;SK0102529320;1110;;Centrum pre chemické látky a prípravky;Centrum pre chemické látky a prípravky;Rusňák;Peter;1;51;Mierová;;19;82715;Bratislava 212
36069493;01.07.2001;30.06.2005;"17056489; 30808502";;;;321;4;20;610;0;999;SK010;SK0104;SK0104529389;1110;;Agentúra na podporu vedy a techniky;Agentúra na podporu vedy a techniky;;;;;Hanulova;;5;84101;Bratislava 42
35815256;01.07.2001;31.12.2500;"00211290; 00584941";;35230;"58190; 69200; 49509; 52100; 52210; 56109; 49390; 45200; 47300; 71200; 73200; 46900; 91010; 43220";121;4;99;101;25;140;SK010;SK0102;SK0102529320;1100;11001;Slovenský plynárenský priemysel, a.s.;Slovenský plynárenský priemysel, a.s.;Šabík;Štefan;1;;Mlynské nivy;44;a;82511;Bratislava 26
36069655;01.07.2001;31.12.2500;;164381;91010;;321;4;20;610;6;999;SK010;SK0105;SK0105529460;1110;13110;Slovenská pedagogická knižnica;Slovenská pedagogická knižnica;Grigar;Vladimír;8;;Hálova;;6;85101;Bratislava 5
36069841;01.08.2001;31.12.2500;37926055;;84110;;321;4;99;610;21;999;SK010;SK0102;SK0102529320;1110;13110;Úrad pre reguláciu sieťových odvetví;Úrad pre reguláciu sieťových odvetví;Holienčík;Jozef;1;53;Bajkalská;;27;82007;Bratislava 27
36061701;01.07.2001;31.12.2500;;;84240;;321;4;41;610;23;999;SK010;SK0105;SK0105529460;1110;13110;Národný bezpečnostný úrad;Národný bezpečnostný úrad;Magala;Jozef;1;;Budatínska;;30;85106;Bratislava 5
36070513;01.10.2001;31.12.2500;35710331;686832;84130;;331;4;26;610;12;10;SK010;SK0102;SK0102529320;1110;13110;Slovenská agentúra pre rozvoj investícií a obchodu;SARIO;;;;;Trnavská cesta;;100;82101;Bratislava 2
166251;01.01.1970;31.12.2500;;166260;72190;;331;4;31;610;7;10;SK010;SK0102;SK0102529320;1110;13110;Výskumný ústav geodézie a kartografie v Bratislave;Výskumný ústav geodézie a kartografie;Hamaš;Ľudovít;1;;Chlumeckého;;4;82662;Bratislava 29
35822163;15.10.2001;31.12.2500;30844169;;68200;"01610; 52210; 68310; 55100; 43220; 46180; 73200; 43390; 43210";121;4;10;101;11;50;SK010;SK0101;SK0101528595;1100;11001;Správa služieb diplomatickému zboru, a.s.;Správa služieb diplomatickému zboru, a.s.;Černý;Marek;1;;Palisády;;31;81106;Bratislava 1
36210137;29.10.2001;31.12.2500;;;35300;"43130; 71122";121;4;99;101;0;10;SK042;SK0425;SK0425599824;1100;11001;GEOTERM KOŠICE, a.s.;GEOTERM KOŠICE, a.s.;Karkó;Roland;1;;Moldavská;;12;04011;Košice 11
36246034;01.11.2001;31.12.2500;00152153;;35300;"71200; 71121; 43210; 45200";121;4;57;101;21;80;SK021;SK0217;SK0217506745;1100;11001;Trnavská teplárenská, a.s.;Trnavská teplárenská, a.s.;Lidik;Richard;1;;Coburgova;;84;91742;Trnava 2
37794663;01.09.2001;31.12.2007;;;85329;;321;4;20;610;0;999;SK041;SK0412;SK0412520004;1110;;Odborné učilište internátne pre telesne postihnutú mládež Humenné;Odborné učilište internátne pre telesne post;;;;;Komenského;;3;06601;Humenné 1
36062090;05.11.2001;20.07.2018;;;66190;;381;4;99;441;0;999;SK010;SK0102;SK0102529320;1110;13110;Recyklačný fond v likvidácii;Recyklačný fond v likvidácii;Nevický, MBA;Oto;6;;Nevädzová;;5;82101;Bratislava 3
35823551;01.11.2001;31.12.2500;00152153;;70100;"56109; 55100; 49390; 43220; 26110; 45200; 71200; 33130";121;4;99;101;22;110;SK010;SK0101;SK0101528595;1100;11001;Západoslovenská energetika, a.s.;Západoslovenská energetika, a.s.;Kley;Jochen;;;Čulenova;;6;81647;Bratislava 1
35823542;01.11.2001;31.12.2500;00152153;;35300;"56109; 71200; 46900; 35110; 55200; 49390; 45200";121;4;99;101;24;110;SK010;SK0103;SK0103529346;1100;11001;Bratislavská teplárenská, a.s.;Bratislavská teplárenská, a.s.;Raček;Vladimír;1;;Turbínová;;3;82905;Bratislava 3
37808214;01.10.1997;30.06.2006;;;;;321;4;20;610;0;999;SK031;SK0319;SK0319512729;1110;;Základná škola pri Slovenských liečebných kúpeľoch, a.s.;ZŠ pri Slovenských liečebných kúpeľoch,a.s.;;;;;SNP;;519;03901;Turčianske Teplice
37808249;01.03.1997;31.08.2006;;;;;321;4;20;610;0;999;SK031;SK0312;SK0312509132;1110;;Základná škola pri Nemocnici s poliklinikou;Základná škola pri Nemocnici s poliklinikou;;;;;Palárikova;;2311;02201;Čadca 1
37808257;01.03.1997;31.08.2006;;;;;321;4;20;610;0;999;SK031;SK031B;SK031B517402;1110;;Základná škola, Materská škola pri Nemocnici s poliklinikou;Základná škola, Materská škola pri NsP;;;;;V. Spanyola;;43;01207;Žilina 1
37808273;01.03.1997;31.08.2006;;;;;321;4;20;610;0;999;SK031;SK0313;SK0313509540;1110;;Základná škola pri Nemocnici s poliklinikou;Základná škola pri Nemocnici s poliklinikou;;;;;Nemocničná;1944;4;02601;Dolný Kubín 1
37808265;01.03.1997;31.08.2006;;;;;321;4;20;610;0;999;SK031;SK0315;SK0315510262;1110;;Základná škola, Materská škola pri Nemocnici s poliklinikou;Základná škola, Materská škola pri NsP;;;;;Palúčanská;;25;03123;Liptovský Mikuláš 1
37808281;01.03.1997;31.08.2006;;;;;321;4;20;610;0;999;SK031;SK0318;SK0318510998;1110;;Základná škola, Materská škola pri Nemocnici s poliklinikou;Základná škola, Materská škola pri NsP;;;;;Zárevúcka;;3;03401;Ružomberok 1
37808303;01.03.1997;31.08.2006;;;;;321;4;20;610;0;999;SK031;SK031A;SK031A510106;1110;;Základná škola, Materská škola pri Nemocnici s poliklinikou;Základná škola, Materská škola pri NsP;;;;;Mieru;549;16;02801;Trstená
37808338;01.03.1997;31.08.2006;;;;;321;4;20;610;0;999;SK031;SK0318;SK0318510807;1110;;Základná škola pri Národnom endokrinologickom a diabetologickom ústave;ZŠ pri Národnom endokrinol. a diabet. ústave;;;;;Ľubochňa;;145;03491;Ľubochňa
35540249;01.01.2002;30.09.2013;;;84130;;321;4;31;610;0;999;SK042;SK0425;SK0425599824;1110;;Správa katastra Košice;Správa katastra Košice;Trembeczká;Eva;1;;Južná trieda;;82;04017;Košice 1
36125474;01.01.2002;30.09.2013;;;84130;;321;4;31;610;0;999;SK022;SK0229;SK0229505820;1110;;Správa katastra Trenčín;Správa katastra Trenčín;Kvocerová;Eva;3;;Piaristická;;25;91150;Trenčín 1
37808095;01.01.2002;30.09.2013;;;84130;;321;4;31;610;0;999;SK031;SK031B;SK031B517402;1110;;Správa katastra Žilina;Správa katastra Žilina;Štrengerová;Anna;1;;A. Kmeťa;;17;01132;Žilina 1
37836501;01.01.2002;31.12.2500;"36085651; 00011037";;85600;;321;4;20;610;7;999;SK021;SK0217;SK0217506745;1110;13110;Centrum pedagogicko-psychologického poradenstva a prevencie;Centrum pedagog.-psych. porad. a prevencie;Kuracinová;Ivica;16;;M. Sch. Trnavského;;2;91701;Trnava 1
35540915;01.01.2002;31.12.2500;;;85200;;321;4;20;610;6;999;SK042;SK042A;SK042A526592;1110;13110;Špeciálna základná škola Hrabušice;Špeciálna základná škola Hrabušice;Jendrál;Milan;16;;Hviezdoslavova;;164;05315;Hrabušice
35540931;01.01.2002;31.08.2005;;;;;321;4;20;610;0;999;SK042;SK042B;SK042B528374;1110;;Špeciálna základná škola Hrčeľ;Špeciálna základná škola Hrčeľ;Kopinecová;Júlia;16;;Hlavná;;75;07615;Veľaty
36071072;01.01.2002;30.09.2013;;;84130;;321;4;31;610;0;999;SK010;SK0102;SK0102529320;1110;;Správa katastra pre hlavné mesto SR Bratislavu;Správa katastra pre hl. mesto SR Bratislavu;Stuparinová;Oľga;1;;Chlumeckého;;2;82103;Bratislava 2
36071242;01.01.2002;31.12.2500;;;85600;;321;4;20;610;6;999;SK010;SK0108;SK0108508217;1110;13110;Centrum pedagogicko-psychologického poradenstva a prevencie;Centrum pedagog.-psychologického poradenstva;Gáliková;Marcela;8;;Lichnerova;;61;90301;Senec
37836196;01.01.2002;30.09.2013;;;84130;;321;4;31;610;0;999;SK021;SK0217;SK0217506745;1110;;Správa katastra Trnava;Správa katastra Trnava;Švecová;Monika;1;;Vajanského;;2;91701;Trnava 1
37827731;01.01.2002;30.09.2013;;;84130;;321;4;31;610;0;999;SK032;SK0321;SK0321508438;1110;;Správa katastra Banská Bystrica;Správa katastra Banská Bystrica;Šišovský;Jakub;3;;Nám. Ľ.Štúra;;1;97405;Banská Bystrica 5
37808508;01.01.2002;31.12.2013;;;84130;;321;4;29;610;0;999;SK031;SK031B;SK031B517402;1110;;Poštový regulačný úrad;Poštový regulačný úrad;;;;;ul. 1. mája;;16;01001;Žilina 1
37828436;01.01.2002;31.12.2500;37893823;;85600;;321;4;20;610;5;999;SK032;SK0323;SK0323508497;1110;13110;Centrum pedagogicko - psychologického poradenstva a prevencie;Centrum pedag-psych.porad.;Jorčíková;Oľga;16;;Hradby;;9;97701;Brezno 1
37870173;01.01.2002;30.09.2013;;;84130;;321;4;31;610;0;999;SK041;SK0417;SK0417524140;1110;;Správa katastra Prešov;Správa katastra Prešov;Švirk;Daniel;3;;Konštantínova;;6;08001;Prešov 1
36403008;01.01.2002;31.12.2500;00152161;;35140;"43340; 41209; 35300; 27900; 85590; 73110; 16231; 74200; 49410; 23610; 62090; 68200; 45200; 43210; 71110; 63110; 55200; 43120; 25720";121;4;99;101;24;140;SK031;SK031B;SK031B517402;1100;11001;Stredoslovenská energetika, a.s.;Stredoslovenská energetika, a.s.;Sekanina;Petr;16;;Pri Rajčianke;8591;4B;01047;Žilina 1
36403016;01.01.2002;31.12.2500;00152161;;35300;"55200; 23610; 45200; 35110";121;4;57;101;22;90;SK031;SK0316;SK0316512036;1100;11001;Martinská teplárenská, a.s.;Martinská teplárenská, a.s.;Polóni;Michal;1;;Robotnícka;;17;03680;Martin 1
36403032;01.01.2002;31.12.2500;00152161;;35300;"55200; 25720; 27900; 71129; 43210; 68200; 47789; 35130";121;4;57;101;22;100;SK031;SK031B;SK031B517402;1100;11001;Žilinská teplárenská, a.s.;Žilinská teplárenská, a.s.;Pompura;František;1;;Košická;;11;01187;Žilina 1
35541431;01.01.2002;31.12.2500;;;85200;;321;4;20;610;7;999;SK042;SK0421;SK0421543501;1110;13110;Špeciálna základná škola;Špeciálna základná škola;Sokolovská;Janka;16;;Richnava;;189;05351;Kluknava
35828226;01.01.2002;31.12.2004;;;;"46900; 85329; 55100; 56109; 46180; 68200; 62020; 74200; 71200; 52240; 52210; 69200; 35300";121;4;29;101;0;999;SK010;SK0102;SK0102529320;1100;;Železničná spoločnosť, a.s.;Železničná spoločnosť, a.s.;Kužma;Pavol;1;;Drieňova;;24;82009;Bratislava 29
35541059;01.01.2002;31.08.2003;;;;;321;4;68;610;0;999;SK042;SK0421;SK0421543373;1110;;Špeciálna základná škola;Špeciálna základná škola;Gallo;Július;16;;Školská;;684;05333;Nálepkovo
36211222;01.01.2002;31.12.2500;"00152170; 36573973";;70100;"35300; 71200";121;4;99;101;24;110;SK042;SK0422;SK0422598186;1100;11001;Východoslovenská energetika Holding a.s.;Východoslovenská energetika Holding a.s.;Kraus;Karl;;;Mlynská;;31;04291;Košice 1
36052248;01.01.2002;31.12.2500;00152161;;35300;"33140; 47990; 43990; 49410; 55200; 25620; 35110; 43210; 43320; 46900; 71200; 43220; 77320";121;4;57;101;21;90;SK032;SK032B;SK032B518158;1100;11001;Zvolenská teplárenská, a.s.;Zvolenská teplárenská, a.s.;Pobiecký;Jozef;1;;Lučenecká cesta;;25;96150;Zvolen 1
37860381;01.01.2002;30.09.2013;;;84130;;321;4;31;610;0;999;SK023;SK0233;SK0233500011;1110;;Správa katastra Nitra;Správa katastra Nitra;Koiš;Miroslav;1;;Štefánikova tr.;;69;94901;Nitra 1
37862154;15.11.2001;20.03.2002;;;;;321;4;64;610;0;999;SK023;SK0233;SK0233500011;1110;;Fakulta sociálnych vied Univerzity Konštantína Filozofa v Nitre;Fakulta sociálnych vied Univerzity KF;Sollárová;Eva;8;51;Tr.A.Hlinku;;1;94901;Nitra 1
35829141;21.01.2002;31.12.2500;31380751;;35120;"74900; 85590; 55200; 43220; 68200; 91010";121;4;26;101;25;140;SK010;SK0102;SK0102529320;1100;11001;Slovenská elektrizačná prenosová sústava, a.s.;Slov. elektrizačná prenosová sústava, a.s.;Obert;Miroslav;1;;Mlynské nivy;;59/A;82484;Bratislava 26
30790522;01.02.2002;31.12.2003;;;84120;;321;4;20;610;0;999;SK010;SK0104;SK0104529397;1110;;Národný inštitút športu;Národný inštitút športu;;;;;Karloveská;;64;84258;Bratislava 4
