31417868;01.07.1992;01.01.2010;;;10710;"68200; 46180; 10720; 77110; 46390; 10610; 47240";121;4;57;101;0;999;SK023;SK0233;SK0233500011;1100;;NIPEK, a.s.;NIPEK, a.s.;Morávek;Ivan;1;;Štúrova;74;138;94935;Nitra 1
31418961;01.08.1992;21.09.2005;;;10510;"73200; 10910; 68200; 22220; 46180; 47290; 52100; 77390; 82920";121;4;57;101;0;999;SK023;SK0233;SK0233500011;1100;;AGROMILK, a.s.;AGROMILK, a.s.;Kováč;Štefan;5;51;Cabajská;;23;94901;Nitra 1
31419593;01.08.1992;26.09.2009;;;31020;;121;4;99;101;0;999;SK022;SK0221;SK0221505625;1100;;TATRAN, a.s.- v konkurze;TATRAN, a.s.- v konkurze;Vaňková;Viera;3;;M.R. Štefánika;;;95641;Uhrovec
31419631;01.08.1992;15.03.2011;;;46210;"52100; 68200";121;4;57;101;0;999;SK021;SK0217;SK0217506745;1100;;Poľnonákup Trnavan, a.s. - v konkurze;Poľnonákup Trnavan, a.s. - v konkurze;Szivos;Peter;1;;Bratislavská;;8;91740;Trnava 2
31421521;01.10.1992;29.04.2005;;;46210;;121;4;57;101;0;999;SK021;SK0212;SK0212504017;1100;;OSeP, a.s. - v konkurze;OSeP, a.s. - v konkurze;Lauko;Štefan;1;;Košútska cesta;;1364;92521;Sládkovičovo
31422101;01.03.1992;21.09.2010;;;1110;"01410; 47760";301;4;27;101;0;999;SK021;SK0211;SK0211501727;1100;;Semenársky štátny majetok, š.p.;Semenársky štátny majetok, š.p.;Barabáš;Vojtech;1;;Kvetoslavov;;;93041;Kvetoslavov
31424163;04.08.1992;31.12.2500;;686832;47590;;301;4;26;101;0;999;SK023;SK0236;SK0236504998;1100;11001;REMOS, š.p.;REMOS, š.p.;;;;;Dopravná;;5;95501;Topoľčany 1
31428754;03.02.1993;08.11.2000;;;;;301;4;26;101;0;999;SK021;SK0216;SK0216504378;1100;;Výrobné prevádzky, štátny podnik - v konkurze;Výrobné prevádzky, štátny podnik - v konkurz;;;;;Vrádišťská;;8;90851;Holíč 1
31431771;01.11.1992;29.01.2013;;;68200;"62020; 46510";121;4;57;101;0;999;SK023;SK0233;SK0233500011;1100;;DATANÁKUP s.r.o.;DATANÁKUP s.r.o.;Bystričanová;Slávka;;;Cabajská;;25;94901;Nitra 1
31437478;01.06.1993;13.12.2005;;;13950;;301;4;26;101;0;999;SK023;SK0231;SK0231501361;1100;;NETEX, štátny podnik v likvidácii;NETEX, štátny podnik v likvidácii;Vajcík;Bohumil;1;;Tôň;;;94615;Tôň
31438709;30.06.1993;14.03.2008;;;71110;;121;4;99;101;0;999;SK022;SK0229;SK0229505820;1100;;Vodné dielo Žilina, a.s. v likvidácii;Vodné dielo Žilina, a.s. v likvidácii;Porubänová;Darina;3;;Soblahovská;;2;91101;Trenčín 1
31439608;16.07.1993;31.12.2500;;;46900;"46190; 46170; 46110; 46120; 46130; 46390; 46460; 46730; 46740; 82920; 46160; 46140";112;4;99;101;0;999;SK023;SK0233;SK0233500011;1100;11001;VONIT TRADE spol. s r.o.;VONIT TRADE spol. s r.o.;Divok;Jaroslav;1;;Rastislavova;;12;94901;Nitra 1
31442510;01.07.1993;31.12.2500;"00161276; 00399621";30845572;33110;;301;4;11;101;0;10;SK022;SK0224;SK0224506338;1110;13110;Vojenský opravárenský podnik    Nové Mesto nad Váhom, štátny podnik v likvidácii;Voj.opravár.podnik N.Mesto n/V.š.p.v likv.;Olšavský;Emanuel;1;;Železničná;;1;91537;Nové Mesto nad Váhom
31447694;10.11.1993;21.10.2008;;;1450;;301;4;27;101;0;999;SK021;SK0211;SK0211501905;1100;;Žrebčinec Šamorín, štátny podnik;Žrebčinec Šamorín, štátny podnik;Seman;Pavol;5;;Šamorín;;;93101;Šamorín
31447708;10.11.1993;31.12.2500;36534587;;1430;"37000; 46180; 11020; 01620; 01500; 56290; 46230";301;4;27;610;12;30;SK023;SK0237;SK0237500828;1110;13110;"Národný žrebčín ""Topoľčianky"" štátny podnik";"Národný žrebčín ""Topoľčianky"" štátny podnik";Horný;Michal;1;;Parková;;13;95193;Topoľčianky
31450971;09.11.1994;31.12.2500;;;1130;"52100; 46310; 47210";121;4;99;101;0;10;SK023;SK0233;SK0233558320;1110;13110;Zeloprodukt, akciová spoločnosť /konkurz/;Zeloprodukt, akciová spoločnosť /konkurz/;Schultz;Peter;1;;Mojmírovská;;13;95112;Ivanka pri Nitre
31561926;01.05.1992;22.09.2010;;;28150;"71200; 46150";121;4;57;101;0;999;SK031;SK031B;SK031B517402;1100;;ZVL ŽILINA, a.s.;ZVL ŽILINA, a.s.;Štofik;Jozef;1;;Na stanicu;;;01009;Žilina 9
31562337;01.05.1992;31.12.2500;00010430;;28290;;121;4;57;101;0;999;SK032;SK032C;SK032C516759;1100;13110;SANDRIK DOLNÉ HÁMRE, a.s.;SANDRIK DOLNÉ HÁMRE, a.s.;Garaj;Ján;1;;;;;96661;Hodruša - Hámre 1
31562795;01.05.1992;31.12.2500;;;71129;"27400; 77110; 43330; 56300; 56109; 69200; 25620";121;4;57;101;11;10;SK031;SK031B;SK031B517402;1100;11001;I N G E O a.s. Ž I L I N A;I N G E O a.s. Ž I L I N A;Kováčová;Katarína;16;;Bytčická;;16;01001;Žilina 1
31564780;01.06.1992;23.04.2010;;;11010;;121;4;57;101;0;999;SK032;SK0321;SK0321508438;1100;;FATRA, a.s.;FATRA, a.s.;Čerevka;Igor;3;;Zvolenská cesta;;14;97403;Banská Bystrica 3
31565964;03.06.1992;19.02.2013;;;41209;;501;4;99;101;0;999;SK022;SK0222;SK0222513016;9100;;SIBAMAC, a.s.;SIBAMAC, a.s. odšt.závod;;;;;Bratislavská cesta;354;32;01841;Dubnica nad Váhom 1
31565972;03.06.1992;21.12.2007;;;41209;;501;4;99;101;0;999;SK022;SK0226;SK0226512842;9100;;SIBAMAC a.s. OZ Považská Bystrica;SIBAMAC a.s. OZ Považská Bystrica;Hunana;Jaroslav;1;;Mládežnícka;325;25;01701;Považská Bystrica 1
31566421;01.07.1992;31.12.2500;;;46740;56300;121;4;57;101;2;10;SK031;SK0316;SK0316512036;1100;11001;KOMES, a.s.;KOMES, a.s.;Chropovský;Ladislav;1;;Sládkovičova;;7;03680;Martin 1
31567606;01.08.1992;31.12.2500;;;31090;;121;4;57;101;0;999;SK032;SK0326;SK0326511391;1110;13110;NOVONA, a.s.;NOVONA, a.s.;Baláž;Vladimír;1;;Šávoľská cesta;;62;98612;Fiľakovo
31568289;01.08.1992;07.07.2009;;;10110;01500;121;4;57;101;0;999;SK032;SK0326;SK0326511919;1100;;Novohradská hydina, a.s.;Novohradská hydina, a.s.;;;;;Tomášovce;;435;98556;Tomášovce
31568301;01.08.1992;31.12.2500;00154903;;10910;"49410; 46220; 82990";121;4;57;101;0;999;SK023;SK0232;SK0232556777;1110;13110;POĽNOSPOL, a.s.;POĽNOSPOL, a.s.;Konderla;Tibor;1;;1.mája;;;98002;Jesenské
31568327;01.08.1992;17.03.2015;00154903;;10910;;121;4;57;101;0;999;SK032;SK0328;SK0328515612;1100;11001;POĽNOPRODUKT,a.s.;POĽNOPRODUKT,a.s.;Dorkin;Ján;3;;Roľnícka;;;98201;Tornaľa
31571182;01.10.1992;31.12.2500;;;71129;;121;4;57;101;0;999;SK032;SK032B;SK032B518158;1110;13110;INVESTING, a.s. v konkurze;INVESTING, a.s. v konkurze;Antal;Robert;16;;Kozačeka;2003;40;96038;Zvolen 1
31571450;01.10.1992;07.07.2009;31874738;;64190;;121;4;57;421;0;999;SK032;SK0321;SK0321508438;1100;;Dopravná banka, akciová spoločnosť v konkurze;Dopravná banka, akciová spoločnosť;Koval;Juraj;3;;Česko-slovenskej armády;;24;97401;Banská Bystrica 1
31575421;01.12.1992;31.12.2500;;686832;14140;;301;4;26;101;0;999;SK032;SK032A;SK032A515850;1100;11001;TEAMTEX, štátny podnik;TEAMTEX, štátny podnik;;;;;Madácha;;4;99001;Veľký Krtíš
31576486;01.12.1992;31.10.2002;;;46410;;301;4;26;101;0;999;SK032;SK0322;SK0322516643;1100;;KOMTEX, š.p. v likvidácii;KOMTEX, š.p. v likvidácii;Pálová;Pavla;;;Pletiarska;;1;96901;Banská Štiavnica 1
31576508;01.12.1992;31.12.2500;;686832;14390;;301;4;26;101;0;999;SK032;SK0322;SK0322516643;1110;13110;PLETA, štátny podnik v likvidácii;PLETA, štátny podnik v likvidácii;Szabó;Ladislav;1;;Pletiarska;;1;96941;Banská Štiavnica 1
31577466;01.01.1993;30.06.2000;;;23200;;301;4;26;101;0;999;SK032;SK0322;SK0322516627;1100;;Dinas, š.p.;Dinas, š.p.;Mihálik;Ivan;1;;;;;96615;Banská Belá
31577920;01.01.1993;31.12.2500;;;2200;"01700; 33120; 49410; 41209; 08120; 73110";301;4;11;101;24;90;SK032;SK032B;SK032B518689;1100;11001;Vojenské lesy a majetky SR, štátny podnik;Vojenské lesy a majetky SR, štátny podnik;Jurica;Ján;1;;Lesnícka;;23;96263;Pliešovce 1
31594409;01.11.1993;25.10.2008;;;28110;77390;121;4;57;101;0;999;SK031;SK0316;SK0316512036;1100;;MARTIN DIESEL, a.s.;MARTIN DIESEL, a.s.;Zachar;Ivan;1;;Langsfeldova;;1;03680;Martin 1
31595057;17.11.1993;13.03.2001;;;;"56109; 43220; 23610";112;4;99;101;0;999;SK032;SK032D;SK032D516589;1100;;ZSNP STO, spol. s r.o.;ZSNP STO, spol. s r.o.;Tesáková;Jana;1;;Priemyselná;;12;96501;Žiar nad Hronom 1
31598358;11.01.1994;28.01.2000;;;68100;;121;4;99;101;0;999;SK031;SK0316;SK0316512036;1100;;"Turčianske strojárne, a.s. Martin ""v likvidácii""";"Turčianske strojárne, a.s. Martin ""v likvidá|Škrko|Jozef|16||Českoslov.armády|3|1697|03601|Martin 1";;;;;;;;;
31599214;01.01.1994;14.07.1998;;;;;301;4;29;101;0;999;SK031;SK0316;SK0316512036;1100;;Nákladná automobilová doprava Martin, š.p.;Nákladná automobilová doprava Martin, š.p.;Valent;Libor;1;;Kollárova;;125;03601;Martin 1
31599290;01.01.1994;31.12.2500;;30416094;49410;45200;301;4;29;101;0;999;SK032;SK0326;SK0326511218;1100;11001;Nákladná automobilová doprava Lučenec, š.p.;Nákladná automobilová doprava Lučenec, š.p.;;;;;Mikušovská;;5;98458;Lučenec 1
31604595;13.04.1994;13.11.2010;;;46900;;121;4;99;101;0;999;SK032;SK032B;SK032B518158;1100;;REMPOX, a.s.;REMPOX, a.s.;;;;;Lieskovská cesta;;;96114;Zvolen
31607420;01.05.1994;30.11.1999;;;;;301;4;26;101;0;999;SK022;SK0227;SK0227513881;1100;;PRIEMSTAV Prievidza, š.p. v likvidácii;PRIEMSTAV Prievidza, š.p. v likvidácii;Vlasák;Jozef;1;;Hviezdoslavova;;3;97176;Prievidza 1
31611028;15.08.1994;12.11.2003;;;23610;;301;4;26;101;0;999;SK031;SK031B;SK031B517402;1100;;PODNIK PANELOVEJ VÝROBY, š.p. v likvidácii;PODNIK PANELOVEJ VÝROBY, š.p. v likvidácii;Ščamka;Ignác;1;;Kamenná cesta;;3;01088;Žilina 1
31611508;01.09.1994;25.11.2011;;;1110;;301;4;27;101;0;999;SK032;SK0324;SK0324518921;1100;;Semenársky štátny majetok Vígľaš, š.p. v likvidácii;Semenársky štátny majetok Vígľaš, š.p. v lik;Bakša;Miroslav;1;;Pstruša;;366;96202;Vígľaš
31612814;31.08.1994;24.12.2008;;;1500;;301;4;27;101;0;999;SK032;SK0326;SK0326511218;1100;;Semenársky štátny majetok, štátny podnik v likvidácii;Semenársky štátny majetok, š.p. v likvidácii;Kokavec;Ladislav;1;;Parný mlyn;;3074;98401;Lučenec 1
31612911;31.08.1994;10.05.1999;;;;;301;4;27;101;0;999;SK032;SK032A;SK032A516384;1100;;Semenársky štátny majetok Slovenské Ďarmoty,štátny podnik;Semenársky štátny majetok Slovenské Ďarmoty,;Strhár;Samuel;1;;Slovenské Ďarmoty;;98;99107;Slovenské Ďarmoty
31615295;01.10.1994;22.04.2010;;;27510;;121;4;57;101;0;999;SK032;SK0323;SK0323508870;1100;;Strojsmalt, a.s.;Strojsmalt, a.s.;Šramka;Peter;3;;Pohorelská Maša;;72;97669;Pohorelá
31615562;01.10.1994;31.12.2500;;;13200;;121;4;57;101;0;999;SK032;SK0326;SK0326511218;1110;13110;"LUTE, a.s. ""v likvidácii""";"LUTE, a.s. ""v likvidácii""";Magová;Judita;1;;Gemerská cesta;;1;98401;Lučenec 1
31615678;01.10.1994;18.07.2000;;;71200;;301;4;18;101;0;999;SK031;SK0319;SK0319512729;1100;;Geoekologické laboratória, š.p.;Geoekologické laboratória, š.p.;;;;;Robotnícka;841;20;03913;Turčianske Teplice
31615902;01.10.1994;29.11.2008;;;31010;;121;4;57;101;0;999;SK022;SK0227;SK0227513997;1100;;Výroba kovového nábytku, a.s. v konkurze;Výroba kovového nábytku, a.s. v konkurze;Schnierer;Igor;1;;Žiarska;;46;97251;Handlová
31615961;01.10.1994;31.12.2500;00153834;;41209;"46900; 45200; 69200";121;4;57;101;0;999;SK031;SK031B;SK031B517402;1100;11001;Stredoslovenské stavby, a.s.;Stredoslovenské stavby, a.s.;Vladár;Karol;1;;J. Kráľa;;2;01053;Žilina 1
31617841;01.11.1994;10.08.2006;;;;47190;121;4;57;101;0;999;SK032;SK0324;SK0324518468;1100;;ZTS Hriňovské strojárne, a.s.;ZTS Hriňovské strojárne, a.s.;Matulová;Mariana;3;;Partizánska;;1465;96205;Hriňová
31623042;01.02.1995;31.12.2500;;;1470;"46900; 55100; 10710";121;4;99;101;0;999;SK032;SK0326;SK0326511552;1110;13110;"Lovinobanská poľnohospodárska, a.s. skrátený názov LP a.s. ""v likvidácii""";Lovinobanská poľnohospodárska, a.s. v likv.;Ličko;Štefan;1;;Železničná;;13;98554;Lovinobaňa
31628061;01.05.1995;26.10.2010;;;24510;46900;121;4;57;101;0;999;SK031;SK0316;SK0316512036;1100;;"MARTINMETAL, a.s. ""v konkurze""";"MARTINMETAL, a.s. ""v konkurze""";Puliš;Peter;;;Robotnícka;14;947;03601;Martin 1
31632394;30.06.1995;31.12.2500;;;28490;;121;4;99;101;0;999;SK032;SK032D;SK032D517364;1100;13110;Stredoslovenské strojárne VYHNE, a.s. v likvidácii;Stredoslovenské strojárne VYHNE, a.s. v likv;Oravec;Bc. Tomáš;1;;;;;96602;Vyhne
31631720;01.07.1995;31.12.2001;31631754;;;45200;301;4;29;101;0;999;SK032;SK0321;SK0321508438;1100;;Slovenská autobusová doprava Banskobystrická dopravná spoločnosť,štátny podnik;Slovenská autobusová doprava Banskobystrická;Matuška;Peter;1;;Partizánska cesta;;97;97467;Banská Bystrica 1
31631746;01.07.1995;12.08.1999;;;;"52210; 68200; 46190";301;4;29;101;0;999;SK031;SK0314;SK0314509256;1100;;Slovenská autobusová doprava Kysucké Nové Mesto,štátny podnik;Slovenská autobusová doprava Kysucké Nové Me;Vislocký;Michal;;;Rudinská cesta;;630;02401;Kysucké Nové Mesto 1
31631754;01.07.1995;31.08.1999;;;;"52210; 68200; 45200";301;4;29;101;0;999;SK032;SK0323;SK0323508497;1100;;Slovenská autobusová doprava Brezno,štátny podnik;Slovenská autobusová doprava Brezno,štátny p;Kupčok;Slavomír;1;;Cesta osloboditeľov;;31;97701;Brezno
31631762;01.07.1995;31.08.1999;;;;"68200; 52210; 45200";301;4;29;101;0;999;SK032;SK0324;SK0324518263;1100;;Slovenská autobusová doprava Detva,štátny podnik;Slovenská autobusová doprava Detva,štátny po;Košút;Stanislav;1;;Sídlisko;;1183;96212;Detva-Sídlisko
31631797;01.07.1995;01.09.1999;;;;"68200; 45200";301;4;29;101;0;999;SK031;SK0318;SK0318510998;1100;;Slovenská autobusová doprava Ružomberok,štátny podnik;Slovenská autobusová doprava Ružomberok,štát;Ceniga;Pavel;1;;Bystrická cesta;;;03450;Ružomberok 1
31631801;01.07.1995;31.05.2002;"31631886; 31631819; 31631762";;;"85530; 52210; 45200; 68200; 71200";301;4;29;101;0;999;SK032;SK032B;SK032B518158;1100;;Slovenská autobusová doprava Zvolen,štátny podnik;Slovenská autobusová doprava Zvolen,štátny p;Mazán;Anton;1;;Balkán;;53;96095;Zvolen 1
31631819;01.07.1995;31.08.1999;;;;"45200; 52210; 68200";301;4;29;101;0;999;SK032;SK032D;SK032D599328;1100;;Slovenská autobusová doprava Žiar nad Hronom,štátny podnik;Slovenská autobusová doprava Žiar nad Hronom;Truben;Ján;1;;Priemyselná;;257;96513;Žiar nad Hronom 1
31631827;01.07.1995;26.08.1999;;;;"45200; 68200; 52210";301;4;29;101;0;999;SK031;SK0312;SK0312509132;1100;;Slovenská autobusová doprava Čadca,štátny podnik;Slovenská autobusová doprava Čadca,štátny po;Šimčisko;Jozef;1;;Andreja Hlinku;;1608;02201;Čadca 1
31631835;01.07.1995;12.08.1999;;;;"52210; 45200; 68200";301;4;29;101;0;999;SK031;SK0312;SK0312509507;1100;;Slovenská autobusová doprava Turzovka,štátny podnik;Slovenská autobusová doprava Turzovka,štátny;Cisárik;Vladimír;1;;R. Jašíka;;9;02354;Turzovka
31631843;01.07.1995;31.12.1999;;;;"68200; 45200";301;4;29;101;0;999;SK022;SK0222;SK0222513156;1100;;Slovenská autobusová doprava Ilava, štátny podnik;Slovenská autobusová doprava Ilava, štátny p;Maslák;Štefan;1;;Štúrova;384;28;01980;Ilava
31631860;01.07.1995;01.06.2002;34005552;;;"45200; 52210; 68200";301;4;29;101;0;999;SK022;SK0227;SK0227513881;1100;;Slovenská autobusová doprava Prievidza, štátny podnik;Slovenská autobusová doprava Prievidza, š.p.;Kližan;Marián;1;;Ciglianska cesta;;1;97136;Prievidza 1
31631878;01.07.1995;31.08.1999;;;;45200;301;4;29;101;0;999;SK032;SK0329;SK0329514462;1100;;Slovenská autobusová doprava Rimavská Sobota,štátny podnik;Slovenská autobusová doprava Rimavská Sobota;Kupka;Vojtech;1;;Cukrovarská;;1842;97980;Rimavská Sobota 1
31631886;01.07.1995;31.08.1999;;;;45200;301;4;29;101;0;999;SK032;SK032A;SK032A516210;1100;;Slovenská autobusová doprava Modrý Kameň,štátny podnik;Slovenská autobusová doprava Modrý Kameň,štá;Gabúľ;Vladimír;1;;Jarmočná;332;29;99280;Modrý Kameň
31631894;01.07.1995;12.08.1999;;;;"52210; 45200; 68200";301;4;29;101;0;999;SK031;SK0316;SK0316512036;1100;;Slovenská autobusová doprava Martin,štátny podnik;Slovenská autobusová doprava Martin,štátny p;Boďa;Miloslav;1;;Kollárova;;125;03644;Martin 1
31631908;01.07.1995;31.12.1999;;;;"68200; 52210; 45200";301;4;29;101;0;999;SK022;SK0228;SK0228513610;1100;;Slovenská autobusová doprava Púchov,štátny podnik;Slovenská autobusová doprava Púchov,štátny p;Drábik;Štefan;;;Trenčianska;;460;02021;Púchov 1
31631916;01.07.1995;07.07.1998;;;;"52210; 45200; 68200";301;4;29;101;0;999;SK032;SK0325;SK0325518557;1100;;Slovenská autobusová doprava Krupina,štátny podnik;Slovenská autobusová doprava Krupina,štátny;Schmidt;Vladimír;;;Krupinica;;429;96323;Krupina
31631932;01.07.1995;09.05.2002;"31631878; 31710395";;;"45200; 71200; 68200; 52210";301;4;29;101;0;999;SK032;SK0326;SK0326511218;1100;;Slovenská autobusová doprava Lučenec,štátny podnik;Slovenská autobusová doprava Lučenec,štátny;Morháč;Miroslav;1;;Mikušovská cesta;;5;98427;Lučenec 1
31631941;01.07.1995;01.02.2002;"00680125; 31631797";;;"77110; 77390; 45200; 52100; 46180; 52210; 49390; 68200";301;4;29;101;0;999;SK031;SK0315;SK0315510262;1100;;Slovenská autobusová doprava Liptovský Mikuláš,štátny podnik;Slovenská autobusová doprava Liptovský Mikul;Hološ;Ladislav;1;;Štefánikova;;2;03180;Liptovský Mikuláš 1
31633226;01.08.1995;28.09.2010;;;86909;"11070; 56109";121;4;57;101;0;999;SK031;SK0318;SK0318510637;1100;;Fatranské liečebné kúpele, a.s. v konkurze;Fatranské liečebné kúpele, a.s. v konkurze;Dudák;Vladimír;;;Korytnica;;;03475;Liptovská Osada
31635849;01.09.1995;31.12.2500;;;13100;46150;121;4;57;101;0;999;SK031;SK0312;SK0312509132;1110;13110;PRATEX ČADCA, a.s.;PRATEX ČADCA, a.s.;Korbaš;Peter;;;A. Hlinku;;3;02201;Čadca 1
31636900;01.10.1995;27.03.2009;;;28990;;121;4;57;101;0;999;SK022;SK0228;SK0228512851;1100;;BEST, a.s. Beluša v konkurze;BEST, a.s. Beluša v konkurze;Antal;Mrian;2;;Továrenská;;422;01861;Beluša
31641580;01.01.1996;10.03.2005;;;47110;;121;4;99;101;0;999;SK032;SK032B;SK032B518158;1100;;ZDROJ-STRED, a.s.;ZDROJ-STRED, a.s.;Schwarz;Ivan;3;;Jesenského;;1486;96001;Zvolen 1
31642098;01.01.1996;30.12.2001;00157031;;47110;"56300; 10720";121;4;99;101;0;999;SK032;SK0321;SK0321508438;1100;;PRIMA ZDROJ B.Bystrica, a.s.;PRIMA ZDROJ B.Bystrica, a.s.;Bradová;Elena;1;;Zvolenská cesta;;25;97468;Banská Bystrica 5
31642438;01.01.1996;31.12.2500;00165476;;86909;"56101; 73110; 90040";121;4;99;101;21;40;SK032;SK032B;SK032B518808;1100;11001;KÚPELE SLIAČ a.s.;KÚPELE SLIAČ a.s.;Udič;Jozef;1;;Sliač;;;96231;Sliač - kúpele
31642659;09.01.1996;31.12.2500;;;47730;"46900; 47190; 46190";112;4;99;101;6;40;SK032;SK0323;SK0323508497;1100;11001;LEKÁREŇ PRI NEMOCNICI s.r.o.;LEKÁREŇ PRI NEMOCNICI s.r.o.;Baníková;Alena;16;;Banisko;;1;97701;Brezno 1
31645925;01.03.1996;05.06.2003;00687464;;45200;"46900; 43320; 77390; 77310";121;4;57;101;0;999;SK031;SK031B;SK031B517402;1100;;Stavebná doprava, a.s.;Stavebná doprava, a.s.;Kuriak;Alojz;1;;Závodská cesta;;4;01152;Žilina 1
31651941;01.05.1992;22.06.2012;;;28490;"46310; 73200; 77350; 43220; 52100; 71200; 68200; 62020; 62090; 69200; 25620; 56290; 46190";121;4;57;101;0;999;SK042;SK0427;SK0427522279;1100;;ZEMPLÍNSKE STROJÁRNE a.s.;ZEMPLÍNSKE STROJÁRNE a.s.;Špirko;Juraj;3;;Továrenská;;6;07111;Michalovce 1
31656145;01.08.1992;23.01.2007;;;46210;;121;4;57;101;0;999;SK042;SK0427;SK0427522279;1100;;Poľnonákup Zemplín a.s.;Poľnonákup Zemplín a.s.;Hospodár;Miroslav;3;;Pri Mlyne;;1;07101;Michalovce 1
31656153;01.08.1992;31.12.2500;;;10110;"47220; 46320; 01620";121;4;57;101;0;999;SK042;SK0425;SK0425599816;1110;13110;MÄSO-VÝCHOD a.s.;MÄSO-VÝCHOD a.s.;Hovančák;Ján;3;;Textilná;;4;04030;Košice 12
31664687;01.01.1993;29.05.2008;;;23200;;301;4;26;101;0;999;SK042;SK0422;SK0422599875;1100;;Košický magnezit štátny podnik v likvidácii;Košický magnezit š.p. v likvidácii;Klein;Štefan;1;;Magnezitárska;;11;04013;Košice 13
31664695;01.01.1993;09.03.2006;;;46130;"46190; 47190; 77390; 46900";301;4;26;101;0;999;SK042;SK0422;SK0422598186;1100;;MAGNEZIT SERVIS š.p.;MAGNEZIT SERVIS š.p.;Roják;Marián;1;;J.Čajáka;;1;04001;Košice 1
31660711;01.11.1992;05.03.2016;;;32990;;121;4;57;101;0;999;SK042;SK042B;SK042B528447;1100;11001;ELSTROJ a.s.;ELSTROJ a.s.;Kišš;Imrich;1;;Pribenická;;32;07701;Kráľovský Chlmec 1
31683223;01.01.1994;31.12.2500;;30416094;49410;;301;4;29;101;0;999;SK042;SK0425;SK0425599824;1110;13110;Nákladná automobilová doprava š.p. Košice, v likvidácii;Nákladná automobilová doprava š.p. v likv.Ke;Angelovič;Anton;1;;Južná trieda;;125;04275;Košice 1
31688349;19.04.1994;31.12.2500;;;68200;;301;4;28;101;0;999;SK042;SK0427;SK0427522279;1110;13110;POZEMNÉ STAVBY, štátny podnik v likvidácii;POZEMNÉ STAVBY, štátny podnik v likvidácii;Okoličany;František;1;;Štefana Kukuru;;12;07195;Michalovce 1
31688357;19.04.1994;31.12.2500;;686832;23610;;301;4;26;101;0;999;SK042;SK0427;SK0427522279;1110;13110;PREFA, štátny podnik v likvidácii;PREFA, štátny podnik v likvidácii;Okoličány;František;1;;Priemyselná;;5;07101;Michalovce 1
31693474;22.07.1994;22.05.2009;;;1470;;301;4;27;101;0;999;SK041;SK0417;SK0417524140;1100;;Hydina Šalgovík, štátny podnik v likvidácii;Hydina Šalgovík, štátny podnik v likvidácii;Polomský;Jozef;1;;Šalgovík;;;08001;Prešov 1
31694179;01.08.1994;21.01.2003;;;;;301;4;27;101;0;999;SK042;SK0427;SK0427522724;1100;;Ovocinársky štátny majetok Lesné, štátny podnik v likvidácii;Ovocinársky štátny majetok Lesné, štátny pod;Odekrščiak;Michal;1;;Lesné;;;07101;Michalovce 1
31694233;01.08.1994;26.04.2000;;;;56300;301;4;27;101;0;999;SK041;SK041D;SK041D528820;1100;;Ovocinársky štátny majetok Vranov-Dobrá v likvidácii;Ovocinársky štátny majetok Vranov-Dobrá v li;Vagaský;Pavol;;;Priehrada Domaša;;101;09402;Slovenská Kajňa
31694241;01.08.1994;04.07.2009;;;1240;;301;4;27;101;0;999;SK042;SK0427;SK0427523097;1100;;Ovocinársky štátny majetok Staré, štátny podnik v likvidácii;Ovocinársky štátny majetok Staré, štátny pod;Odekrščiak;Michal;1;;Staré;;;07223;Staré
31694284;01.08.1994;31.12.2500;;;1500;;301;4;27;101;0;999;SK041;SK041C;SK041C527106;1110;13110;Ovocinársky štátny majetok Svidník,štátny podnik v likvidácii;Ovocinársky štátny majetok Svidník,štátny po;Sekelová;Emília;1;;Bardejovská;;1;08901;Svidník
31694632;12.08.1994;12.10.2007;;;41209;;301;4;26;101;0;999;SK042;SK0425;SK0425599816;1100;;STAVBYT Košice, štátny podnik v likvidácii;STAVBYT Košice, štátny podnik v likvidácii;Olšavský;Emanuel;1;;Pri Krásnej;;1;04012;Košice 12
31695434;31.08.1994;12.10.2005;;;1500;;301;4;27;101;0;999;SK042;SK042B;SK042B543772;1100;;Semenársky štátny majetok Somotor, štátny podnik v likvidácii;Semenársky štátny majetok Somotor, štátny po;Barilla;Ján;1;;Somotor;;38;07635;Somotor
31695442;31.08.1994;31.12.2500;;156621;1500;"28300; 33120; 49410; 47190; 46190";301;4;27;101;0;999;SK042;SK0423;SK0423599841;1100;11001;Semenársky štátny majetok Košice-Šaca, štátny podnik;Semen. štátny majetok Košice-Šaca, š.p.;Sabolčák;Marián;1;;Buzinská;;580;04015;Košice 15
31695485;31.08.1994;14.10.2010;;;1500;;301;4;27;101;0;999;SK042;SK042B;SK042B528099;1100;;Šľachtiteľská stanica Trebišov, štátny podnik;Šľachtiteľská stanica Trebišov, štátny podni;Coronič;Pavol;1;;Nová Koronč;1083;1;07501;Trebišov 1
31696911;01.10.1994;31.12.2500;;;71122;;301;4;18;101;0;999;SK042;SK042A;SK042A526355;1110;13110;Geologický prieskum š.p. Spišská Nová Ves v likvidácii;Geologický prieskum š.p. Spišská Nová Ves v;Regec;Pavol;1;;Markušovská cesta;;1;05280;Spišská Nová Ves 1
31704077;01.03.1995;15.01.2011;;;1500;;301;4;27;101;0;999;SK042;SK042B;SK042B528501;1100;;Štátny majetok Mäsoprodukta štátny podnik;Štátny majetok Mäsoprodukta štátny podnik;Matta;Michal;1;;Lastovce;;;07614;Michaľany pri Trebišove
31705405;01.04.1995;31.12.2500;;686832;68320;;301;4;26;101;4;10;SK042;SK042A;SK042A526355;1110;13110;BANE Spišská Nová Ves, štátny podnik v likvidácii;BANE Spišská Nová Ves, š. p. v likv.;Olšavský;Emanuel;1;;Štefánikovo námestie;;4;05254;Spišská Nová Ves 1
31705413;01.04.1995;28.01.2002;;;;46120;301;4;26;101;0;999;SK042;SK042A;SK042A526355;1100;;BMZ - Želba, š.p.;BMZ - Želba, š.p.;Dutko;Jozef;1;;Sadová;;17;05280;Spišská Nová Ves 1
31710271;01.07.1995;01.08.1999;;;;"77310; 45200; 71200";301;4;29;101;0;999;SK041;SK0411;SK0411519006;1100;;Slovenská autobusová doprava, štátny podnik Bardejov;Slovenská autobusová doprava, š.p.BJ;Ščerbák;Dušan;1;;Slovenská;;18;08561;Bardejov 1
31710298;01.07.1995;31.12.2001;"31710425; 31710441";;;"46720; 71200; 46730; 47190; 77110; 45200; 47300";301;4;29;101;0;999;SK041;SK0412;SK0412520004;1100;;Slovenská autobusová doprava, štátny podnik;Slovenská autobusová doprava, štátny podnik;Lacký;Jozef;1;;Fidlikova;;1;06643;Humenné
31710310;01.07.1995;31.12.2001;"36188751; 31710409";;;"47300; 45200; 85530; 56300; 49390; 22110; 46190; 68200; 69200";301;4;29;101;0;999;SK042;SK0422;SK0422598186;1100;;Slovenská autobusová doprava Košická dopravná spoločnosť, štátny podnik;SAD Košická dopravná spoločnosť,š.p.;Gerši;Ľubomír;1;;Staničné nám.;;9;04146;Košice 1
31710328;01.07.1995;01.08.1999;;;;"45200; 49390";301;4;29;101;0;999;SK042;SK042B;SK042B528447;1100;;Slovenská autobusová doprava, štátny podnik Kráľovský Chlmec;Slovenská autobusová doprava, štátny podnik;Sačko;Gejza;;;Pribenická;;;07701;Kráľovský Chlmec 1
31710336;01.07.1995;01.08.1999;;;45200;;301;4;29;101;0;999;SK041;SK0414;SK0414543292;1100;;Slovenská autobusová doprava Oprávarenský podnik Levoča, štátny podnik;Slovenská autobusová doprava Oprávarenský po;Zgodava;Jozef;1;;Popradská cesta;;38;05401;Levoča
31710344;01.07.1995;01.08.1999;;;;"49390; 45200";301;4;29;101;0;999;SK041;SK0418;SK0418524778;1100;;Slovenská autobusová doprava, štátny podnik Lipany;Slovenská autobusová doprava, štátny podnik;Hadzima;Peter;;;Železničná;;;08271;Lipany nad Torysou
